[
  {
    "id": "CC-SYS-FEUDALISM",
    "slug": "feudalism",
    "name": "Feudalism",
    "family": "Historical",
    "era": "Medieval Europe (ideal-type; regional variants)",
    "ownership_model": "Layered land tenure under lords; peasants hold use-rights under obligation",
    "role_of_markets": "Local and limited; land and labor often non-market or weakly marketized",
    "role_of_government": "Fragmented lordship and personal jurisdiction more than modern territorial state",
    "private_property": "Conditional tenure, not modern absolute title",
    "labor_treatment": "Customary dues, labor services, serfdom or dependent peasantry in many settings",
    "concentrated_power_approach": "Hierarchy of military-landholding elites",
    "accountability_source": "Custom, oath, and local force rather than impersonal public law",
    "strengths": [
      "Local order under weak central capacity",
      "Reciprocal (if unequal) protection bargains"
    ],
    "risks": [
      "Arbitrary lordship",
      "Immobility",
      "Violence and fragmented justice"
    ],
    "relationship_to_cc": "Historical contrast: CC requires impersonal constitutional property and citizenship, not personal dependence",
    "historical_exemplars": [
      "High medieval western Europe (ideal-type)",
      "Regional seigneurial regimes"
    ],
    "neighbor_systems": [
      "CC-SYS-GUILD-MEDIEVAL-ECONOMY",
      "CC-SYS-TRIBUTARY-PALACE-ECONOMY",
      "CC-SYS-MERCANTILISM"
    ],
    "dossier_path": "content/public-resources/systems/feudalism.md",
    "status": "developing_analytical_tool"
  },
  {
    "id": "CC-SYS-GUILD-MEDIEVAL-ECONOMY",
    "slug": "guild-medieval-economy",
    "name": "Guild / medieval corporate economy",
    "family": "Historical",
    "era": "Late medieval–early modern urban Europe",
    "ownership_model": "Artisan and merchant corporate ownership within town privileges",
    "role_of_markets": "Regulated markets; entry, quality, and prices often guild-governed",
    "role_of_government": "Municipal and corporate privileges bargain with princes and towns",
    "private_property": "Strong for members within corporate rules; outsiders restricted",
    "labor_treatment": "Apprenticeship and journeyman hierarchies; mastership as gate",
    "concentrated_power_approach": "Corporate monopoly privileges by craft and town",
    "accountability_source": "Guild statutes, municipal courts, custom",
    "strengths": [
      "Quality control",
      "Skill transmission",
      "Member mutual aid"
    ],
    "risks": [
      "Entry barriers",
      "Innovation drag",
      "Insider privilege"
    ],
    "relationship_to_cc": "CC may respect associations and skill standards but rejects closed privilege as a constitutional baseline",
    "historical_exemplars": [
      "Late medieval Italian and Northern European towns",
      "Craft guild charters"
    ],
    "neighbor_systems": [
      "CC-SYS-FEUDALISM",
      "CC-SYS-CORPORATISM",
      "CC-SYS-MERCANTILISM",
      "CC-SYS-COOPERATIVE-ECONOMICS"
    ],
    "dossier_path": "content/public-resources/systems/guild-medieval-economy.md",
    "status": "developing_analytical_tool"
  },
  {
    "id": "CC-SYS-PHYSIOCRACY",
    "slug": "physiocracy",
    "name": "Physiocracy",
    "family": "Historical",
    "era": "18th-century France (intellectual system)",
    "ownership_model": "Private landed property as the productive core",
    "role_of_markets": "Free grain trade and natural price formation emphasized",
    "role_of_government": "Legal despotism in physiocratic theory: strong authority to secure natural order",
    "private_property": "Strong, especially agricultural land",
    "labor_treatment": "Agriculture privileged as productive class; industry often labeled sterile in theory",
    "concentrated_power_approach": "Landed surplus and single tax on net product as fiscal redesign",
    "accountability_source": "Natural law and enlightened administration",
    "strengths": [
      "Early systematic political economy",
      "Critique of mercantilist privilege"
    ],
    "risks": [
      "Agricultural monism",
      "Authoritarian legal-despotism risk",
      "Undervaluation of industry"
    ],
    "relationship_to_cc": "Shares anti-privilege and property themes; CC rejects physiocratic class metaphysics and legal despotism",
    "historical_exemplars": [
      "Quesnay's Tableau économique",
      "Turgot-era reform debates"
    ],
    "neighbor_systems": [
      "CC-SYS-MERCANTILISM",
      "CC-SYS-LAISSEZ-FAIRE-CAPITALISM",
      "CC-SYS-GEORGISM"
    ],
    "dossier_path": "content/public-resources/systems/physiocracy.md",
    "status": "developing_analytical_tool"
  },
  {
    "id": "CC-SYS-TRIBUTARY-PALACE-ECONOMY",
    "slug": "tributary-palace-economy",
    "name": "Ancient tributary / palace economy",
    "family": "Historical",
    "era": "Bronze Age and ancient agrarian empires (ideal-type)",
    "ownership_model": "Palace, temple, or imperial centers claim superior claims on surplus",
    "role_of_markets": "Markets exist at margins; allocation often administered by redistributive centers",
    "role_of_government": "Ruler-centered extraction and redistribution; household of the palace as economic hub",
    "private_property": "Conditional and stratified; elite and institutional holdings dominate",
    "labor_treatment": "Corvée, dependent labor, slavery, and tribute obligations common in variants",
    "concentrated_power_approach": "Central ceremonial-political concentration of surplus",
    "accountability_source": "Divine kingship, temple authority, imperial hierarchy",
    "strengths": [
      "Large-scale mobilization",
      "Grain storage and crisis redistribution capacity"
    ],
    "risks": [
      "Extractive predation",
      "Information and incentive failures",
      "Subject vulnerability"
    ],
    "relationship_to_cc": "Contrary ideal-type: CC rejects palace-centered domination and requires constitutional limits on extractive power",
    "historical_exemplars": [
      "Mycenaean palace records (ideal-type reference)",
      "Ancient Near Eastern redistributive polities (comparative)"
    ],
    "neighbor_systems": [
      "CC-SYS-FEUDALISM",
      "CC-SYS-COMMAND-ECONOMIES",
      "CC-SYS-STATE-CAPITALISM"
    ],
    "dossier_path": "content/public-resources/systems/tributary-palace-economy.md",
    "status": "developing_analytical_tool"
  },
  {
    "id": "CC-SYS-CLASSICAL-REPUBLICAN-MIXED-ECONOMY",
    "slug": "classical-republican-mixed-economy",
    "name": "Classical republican mixed economy",
    "family": "Historical",
    "era": "Greco-Roman and early-modern republican thought; selective practice",
    "ownership_model": "Private household property with civic limits against luxury and dependency",
    "role_of_markets": "Commerce accepted with suspicion of corruption and dependency",
    "role_of_government": "Mixed constitution; civic virtue and anti-domination as political aims",
    "private_property": "Strong for citizens; tied to independence and military/civic capacity",
    "labor_treatment": "Ideal of independent proprietor; historical reliance on slavery or dependents in many republics",
    "concentrated_power_approach": "Agrarian laws, sumptuary norms, and mixed offices to check oligarchy",
    "accountability_source": "Civic virtue, mixed institutions, public contestation",
    "strengths": [
      "Anti-domination ethic",
      "Link of property to citizenship",
      "Suspicion of corrupting concentration"
    ],
    "risks": [
      "Exclusionary citizenship",
      "Slavery and patriarchy in historical republics",
      "Anti-commercial romanticism"
    ],
    "relationship_to_cc": "Major intellectual neighbor on anti-domination and broad independent ownership; CC must reject historical exclusions while learning the independence-property link",
    "historical_exemplars": [
      "Roman republican ideology (idealized)",
      "Machiavelli and Atlantic republican discourse",
      "Early American agrarian republican themes"
    ],
    "neighbor_systems": [
      "CC-SYS-DISTRIBUTISM",
      "CC-SYS-OLIGARCHY",
      "CC-SYS-CONSTITUTIONAL-CAPITALISM",
      "CC-SYS-LAISSEZ-FAIRE-CAPITALISM"
    ],
    "dossier_path": "content/public-resources/systems/classical-republican-mixed-economy.md",
    "status": "developing_analytical_tool"
  },
  {
    "id": "CC-SYS-MERCANTILISM",
    "slug": "mercantilism",
    "name": "Mercantilism",
    "family": "Historical",
    "era": "Early modern European states; recurrent modern echoes",
    "ownership_model": "Mixed private ownership under national strategic direction",
    "role_of_markets": "Trade managed for national advantage; bullion and balance-of-trade focus historically",
    "role_of_government": "Uses tariffs, monopolies, navigation acts, and charters",
    "private_property": "Conditional on sovereign strategy and privilege",
    "labor_treatment": "Labor serves national production and naval/military capacity",
    "concentrated_power_approach": "Chartered monopolies and favored companies common",
    "accountability_source": "Sovereign strategy and fiscal-military state",
    "strengths": [
      "State capacity building",
      "Infant-industry and naval power logics"
    ],
    "risks": [
      "Rent seeking",
      "War and commercial conflict",
      "Consumer costs of privilege"
    ],
    "relationship_to_cc": "CC rejects privilege charters while allowing lawful resilience and competition policy — not mercantile monopoly",
    "historical_exemplars": [
      "Colbertist France",
      "English Navigation Acts era",
      "Chartered companies"
    ],
    "neighbor_systems": [
      "CC-SYS-PHYSIOCRACY",
      "CC-SYS-DEVELOPMENTAL-STATE",
      "CC-SYS-CRONY-CAPITALISM",
      "CC-SYS-LAISSEZ-FAIRE-CAPITALISM"
    ],
    "dossier_path": "content/public-resources/systems/mercantilism.md",
    "status": "developing_analytical_tool"
  },
  {